body,title
"Еще недавно жизнь Анны была вполне благополучна: на работе она считалась лучшей сотрудницей, дома заботилась о стареньком отчиме и воспитывала 15-летнего сына Костю, подающего надежды скрипача. И вдруг, в один миг все пошло прахом. С работы уволили по статье из-за интриг завистников, отчим скоропостижно скончался, не успев оставить завещание, и его родной сын Борис тут же заявил свои права на квартиру и принялся запугивать Анну. Опасаясь за жизнь сына, она срочно переезжает в «однушку» на окраине города, где ее донимают соседи-алкоголики, а Костя становится любимой мишенью для хулиганов-одноклассников из районной школы. Неожиданно на защиту хрупкого юноши встает Надя – дочь бывшего чемпиона по боксу Николая, который растил ее один после смерти жены. Дружба Нади и Кости не нравится их родителям: Анна и Николай с первой встречи почувствовали резкую антипатию друг к другу. Впрочем, когда Анну выселят из квартиры и они с сыном останутся без крова, когда Анна отыщет отца своего ребенка и поймет, что он негодяй, – именно Николай станет для нее надеждой и опорой.",Все к лучшему
"Жизнь рекламщика Кости выглядит успешной: его работа приносит доход и удовлетворение, любимая женщина согласилась выйти замуж.  Но все рушится в один момент: отец Кости умирает, и на его руках оказывается не только семейное дело – фирма-производитель женской обуви, но и беспомощные родственницы, привыкшие к тому, что их проблемы решает глава семейства.  ",Под каблуком
"История жизни легендарного музыкального критика, журналиста, теле- и радиоведущего Артемия Троицкого, который много лет является признанным музыкальным авторитетом не только в России, но и за ее рубежами.",Критик
"1943 год. В белорусских лесах действует партизанский отряд и прикомандированная к нему разведгруппа, возглавляемая майором госбезопасности Семиным. При попытке вербовки высокопоставленного немецкого разведчика Курта Шиммеля Семин получает от него информацию о наличии у немцев химического оружия.",Человек войны
"Илья Шагин по первому образованию - врач, преподававший патологическую физиологию будущим медикам. Похоронив жену, которую не удалось спасти во время родов, Шагин решает установить причину трагедии. Однако справедливости не добивается. Напротив, он теряет работу и попадает в тюрьму по сфабрикованному обвинению. В тюрьме Шагин получает второе, юридическое образование. Освободившись досрочно, он решает сменить сферу деятельности и начинает защищать права тех, кто пострадал от халатности, получил трудовые увечья или некачественную помощь.",Цена жизни
"Молодой талантливый хирург Сергей Назаров работает в одной из лучших больниц Москвы. Вместе со своим другом и коллегой Димой они мечтают об открытии собственной клиники. Занятие любимым делом поглощает всё его время, и в личной жизни Сергея появились проблемы - его отношения с любимой женщиной зашли в тупик. Но случайное знакомство с красавицей Сашей, находящейся проездом в Москве, в корне меняет жизнь всех героев этой романтической истории.",Летний дождь
"Жена Сергея Бабкина Маша получает от своей одноклассницы Светы Рогозиной приглашение на «девичник» – встречу школьных подруг в подмосковном пансионате. У Маши, как и у большинства учениц ее класса, о школе остались тяжелые воспоминания, и виной тому именно Рогозина, королева класса. Но любопытство берет верх и повзрослевшие школьницы съезжаются в пансионат: всем интересно посмотреть друг на друга и на Рогозину, живущую за границей и меняющую одного богатого мужа на другого.","Нежные листья, ядовитые корни"
"Главный герой Грузик еще совсем малыш, но уже открывает свой игрушечный магазин. В его дворе находится волшебный бассейн с шарами, откуда Грузик достает будущие товары. Он знакомится с разными видами фруктов: арбузом, бананами, виноградом, киви. Если их правильно почистить и порезать, то получится аппетитный фруктовый салат. Теперь этот салат украшает витрину магазина.",Магазин Грузика
"Наташа Баранова становится главным технологом объединенного парфюмерного концерна «Новая Эра» - «Дух Советов». Ее отношения с Александром стали более серьезными и осмысленными. Теперь их связывает не только работа, но и общий дом. Но постепенно мелкие проблемы на работе и дома перерастают в череду семейных ссор, рутина сменяет любовную эйфорию. К тому же у Наташи и Александра оказываются совершенно разные взгляды на то, как нужно вести парфюмерный бизнес. ",Парфюмерша 3
"Юлька ненавидела старуху, к которой устроилась домработницей, и одновременно восхищалась ею. Марта Рудольфовна держалась как настоящая королева, но относилась к ней даже хуже, чем к прислуге. Однако ради своего плана Юлька была готова потерпеть… Марта Рудольфовна искренне забавлялась, наблюдая за Юлькой, и умело дергала за нужные струны в ее душе. Девчонка еще не совсем готова для того, чтобы сыграть свою роль…",Танцы марионеток
"Феликс Малинин живет в небольшом городке в ближнем Подмосковье. Среди друзей и знакомых он слывёт неплохим парнем, замкнутым чудаком, постоянно пропадающим в командировках. У Феликса есть небольшое пристрастие – он очень любит готовить, а также у него есть секрет, о котором знают лишь несколько человек.",Кулинар
"В детстве эти трое стояли друг за друга горой, в 90-х, еще учащиеся местной школы, они строили деревянные самолеты на уроке труда. Этому поколению запрещалось даже думать об Америке, они ездили целой школой в Макдоналдс и их наказывали за цитаты из песни Цоя. И судьба у этих ребят сложилась непростая...",Три товарища
После нескольких месяцев затишья в одном из столичных округов возобновляются ритуальные убийства девушек. К расследованию подключается майор полиции Александра Мур.,Коготь из Мавритании 2
"Известного коллекционера Саакянца находят мертвым в его квартире, полной антикварных ценностей. Ничего не пропало, кроме недорогой фарфоровой безделушки. Александре не дает покоя эта мелочь. И неспроста.",Отель «Толедо»
"Громкий выстрел разрушает тишину летнего утра. Что побудило расстаться с жизнью молодого человека 15-ти лет? Ответить на этот вопрос пытается герой Александра Абдулова, рассказывающий нам историю своей жизни, в которой были и счастливые, и горькие минуты.",О любви
"Промышленный город в провинции. Потеряв лучшего друга - любимую собаку Селедку, Соня не находила себе места. У мамы Сони появился ухажер - милиционер Евгений Иванович, и маме стало не до собаки… Главный архитектор края, по совместительству преподаватель в политехническом институте Егор Владимирович устал от жены Кати, которая забросила работу по дому и целыми днями занималась йогой. ",Я Вам больше не верю
"1944 год. На Западной Украине немцы начинают масштабное, но максимально засекреченное строительство. Советское командование обязано узнать истинную цель строительства, ведь именно в этом направлении намечен основной удар советских войск. ",Третьего не дано
"История семьи Шалимовых: крупного бизнесмена и чиновника Юрия, его жены Людмилы, сына Дмитрия и дочки Татьяны. Когда-то родители помешали браку Дмитрия с провинциальной девушкой Юлией, так как присмотрели ему в жены дочь друзей и партнеров по бизнесу Ольгу Гладышеву. Этот поступок в дальнейшем перевернул всю жизнь Шалимовых. Беременная Юлия спешно уехала. Дима поехал догонять любимую и погиб в аварии. Людмила тяжело переживала смерть сына и через год умерла. Случившееся подкосило Юрия, но он старался ради дочки, которая в то время училась в Англии.",Племяшка
"Трагическая судьба Тухачевского и его соратников всегда вызывала огромный общественный интерес и ожесточенные споры. Один из самых ярких героев Гражданской войны, победитель Колчака и Деникина, был в одночасье объявлен главарем военно-фашистского заговора и казнен. Спустя два десятилетия маршала полностью реабилитировали за отсутствием состава преступления. Но завеса тайны над его судьбой так и не была приоткрыта. Было лишь известно, что в 20-х и 30-х годах Тухачевский остро и на протяжении многих лет конфликтовал с наркомом обороны К.Е.Ворошиловым, чьим заместителем являлся. Широко известен случай, когда Тухачевский в присутствии Сталина обвинил наркома Ворошилова в профнепригодности.",Тухачевский: Заговор маршала
"Фильм-размышление о судьбе и личности Александра Вертинского и эпохе Серебряного века, воплощением которой он являлся. В центре сюжета фильма - рассказ о неординарной судьбе артиста, в основу сценария легли воспоминания и малоизвестные письма самого Вертинского.",Вертинский. Одинокий странник
"Георгий Фаворский, владелец крупной британской корпорации, едет в Москву, чтобы сделать предложение бывшей возлюбленной, с которой расстался много лет назад. Но гордая Ангелина не желает видеть бросившего её когда-то жениха, поэтому Фаворский призывает в помощь молодого менеджера Алекса, непревзойденного мастера пикапа. Если тот поможет боссу вернуть возлюбленную, Георгий сделает дерзкого юношу своим преемником.  Алекс не сомневается в успехе, однако… все оказывается не так просто, как он представлял. Ангелина умна и на редкость строптива,  к тому же дело осложняется появлением Алёны,  воинственно настроенной дочери Забелиной.",Невеста из Москвы
"До своей неожиданной кончины бабушка Ада была главой всего семейства. Но и после смерти деловитая старушка не бросает родных на произвол судьбы. Приведение Ады появляется на пороге и сообщает, что в ближайшее время семья может лишиться квартиры. Обескураженные потомки под руководством бабушки-призрака должны рассчитаться с долгами, отвоевать законное наследство, а заодно научиться жить самостоятельно. В противном случае дух бабушки Ады никогда не упокоится с миром.",Семейка Ады
"Дворничиха Нинка Королева, боевая и мощная женщина, выходит замуж за короля Ухотуго, учившегося в нашей стране. Приехав в его тропическое королевство Затраханд, она обнаружила много неприятных сюрпризов - у короля был гарем, три раза в день у всех граждан был обязательный сексуальный час «койка-на-койка», а права женщин были попраны. Тогда Нинка взбунтовала весь «слабый» пол и повела борьбу с «козлами вонючими».",Личная жизнь королевы
"Преуспевающий московский адвокат Елена Анурова возвращается домой из Питера. Елена возвращается раньше срока - она хочет сделать сюрприз любимому мужчине Сергею, с которым они вместе уже 20 лет. ",Любовница
"Почти чеховская история о когда-то успешном режиссере, снимающем свой последний фильм, назло всем, в своем загородном доме. Странные гости, самовлюбленные актеры, чудаковатые соседи и сам режиссер – повод для авторской иронии, а иногда и сарказма. И помните? Чеховское ружье всегда стреляет!",Дядя Саша
"Вот уже который год идет борьба между кланами двух суперзлодеев — Носорога Гегемона и Ядерной Мартышки. Ослепленные жаждой власти над миром, они превратили его в поле боя и, наверное, давно бы уничтожили… Если бы не Специальный Отряд Бесстрашных Зверей!",С.О.Б.Е.З. — Специальный Отряд Бесстрашных Зверей
"Наталья Баранова, директор провинциальной парфюмерной фабрики «Дух Советов», приезжает в Москву, чтобы продвигать авторскую косметическую линейку «Дурнопьян». Москва встречает Наташу неприветливо. Акционеры дают только половину денег на рекламную компанию, первая презентация скорее походит  на  «дурной сон в русском стиле», чем рекламу аромата, и самое главное – московский парфюмерный гигант «Новая Эра» начинает настоящий крестовый поход против «Духа Советов». В довершение всех невзгод, Наташа нечаянно сталкивается со своим старым возлюбленным Ильей.",Парфюмерша 2
"Нику подставляет муж, и она попадает в тюрьму. На зоне она знакомится с «медвежатницей» Дженни, и вскоре они становятся подругами. Через два года, выйдя из тюрьмы, Дженни решает помочь Нике вернуть дом и наказать мужа. Вскоре к девушкам присоединяется брат Дженни – аферист Ден. Так трое молодых людей становятся современными Робин Гудами и спасают умирающую девочку, наказывают врача-взяточника, находят управу на бизнесмена-бандита, защищают обманутых стариков.",Ника
"Что такое человеческий мозг? Орган центральной нервной системы, суперкомпьютер или хозяин, управляющий жизнью человека? Синестеты непроизвольно ассоциируют цифры и буквы с цветами или вкусами. Семерка для них — всегда синяя, а буква А — красная. Люди с прозопагнозией не различают лиц: они видят их, но не помнят. Авторы начали снимать фильм о современных исследованиях мозга в поиске ответа на вопрос: «Могу ли я управлять своим поведением, своей физиологией, своим сознанием?».",Мозг. Вторая Вселенная
"Денис, пилот корабля на рейсах Москва - Санкт-Петербург, без памяти влюбляется в Варю. Она кажется ему единственной и неповторимой, но неожиданно в Питере он встречает Еву, которая ни в чем не уступает его возлюбленной из Москвы. Второй пилот Анна пытается помочь разобраться коллеге в его нелегком положении.",Питер-Москва
"Финальный матч коммерческого турнира по классическим шахматам должен пройти ожидаемо: многолетний чемпион ежегодно снимает кассу, легко обыгрывая всех претендентов. Но в этом году очередной претендент приготовил необычную стратегию.",Цугцванг
"Старшей медсестре городской больницы Анне Виталс, муж которой пропал без вести пять лет назад, приходится одной воспитывать взрослеющую дочь и ухаживать за пожилой матерью. Молодая женщина совсем не думает о себе и живет только работой. Она успешно руководит медицинским персоналом и не уступает в профессиональных навыках ведущим специалистам отделения. Ежедневно по роду своей деятельности Аня сталкивается с трагедией и болью людей, но не теряет чувства сострадания и старается всячески помочь попавшим в беду. Ее жизнь начинает меняться с приходом в больницу нового заведующего кардиологическим отделением Игоря Борисовича...",Медсестра
"Молодой человек давно хотел купить себе велосипед, но никак не мог выбрать какой. Его останавливало непонимание разницы между титановой и стальной втулками в колесе. Почему велосипед с первой втулкой вдвое дороже второго? Отправившись на поиски ответа, герой попадает в водоворот увлекательных событий. В конце концов, он так устает от суматохи, что решает обойтись без велосипеда. Но тут он вспомнил, что давно хотел себе фотоаппарат.",Бесит
