body,title
"В начале 90-х годов ХХ века была незаконно вывезена за границу коллекция эстампажей хакасских наскальных рисунков известного сибирского художника Владимира Капелько. Эстампажи (оттиски на бумагу древних петроглифов) были изготовлены по оригинальному методу Капелько. Особую ценность им придавал тот факт, что большая часть самих рисунков не сохранилась. В результате спецоперации ФСБ коллекция вернулась на родину.",Хакасия. По следам следов наскальных
"Ольга Кострова – уроженка поморского села Умба Кандалакшского района. Арктический гид, краевед и волонтёр экологического движения покажет нехоженые тропы. Территория заповедника для знакомства выбрана неслучайно, ведь он находится на знаменитом пути поморов в загадочную Мангазею. ",Ненецкий заповедник. Дневник поморской путешественницы
2020 год. Несколько дней до начала «Режима самоизоляции (пандемия коронавируса COVID-19)». На окраине Москвы Дима вынужден оказаться в одиночестве. Он решается на психологический эксперимент. Что такое «Круг смерти» и можно ли его разорвать?,Круг смерти
"Жил-был водолаз. Жил-не тужил, работу любил, маму уважал, невеста была. Да вот однажды оказался он перед сложным выбором. В очередном погружении нашел он на дне морском в песке две жемчужины. Обе он подхватил, да и всплыл на берег, чтобы лучше их разглядеть. Оказалась одна жемчужина крупной, редкой черного цвета, а другая – маленькой белой, обыкновенной. Вернулся водолаз домой и подарил большую жемчужину – невесте, а маленькую – маме. Но он даже себе представить не мог, к чему это приведет. Если бы знал, подумал бы дважды, прежде чем дарить эти жемчужины.",Мама водолаза
"На красивом островке, где живут бегемотики, наступает вечер. Бегемотики заканчивают свои игры, собирают игрушки и готовятся слушать сказку перед сном от дядюшки-крокодила. К огоньку на сказку обычно собираются все обитатели острова. И вот сегодня происходит незадача: дядюшка обещал рассказывать про невероятные приключения пиратского корабля, а рассказывает о прекрасных принцессах… Бегемотики Гиппа и Мот чуть было не ссорятся, но мудрый крокодил начинает новую историю, на этот раз – про пиратов. Пиратский корабль приплывает к тихой бухте бегемотов и стреляет. Пока Мот занят изучением настоящего судна, на берег высаживаются крысы-пираты и отбирают игрушки у нежной Гиппы. Но Мот не оставит подружку в беде: он постарается стать рулевым корабля и защитить свой островок.",Истории бегемотов: Пиратский корабль
"Фильм рассказывает о возвращении креста с Софийского собора Великого Новгорода на родину – это случилось спустя 62 года после его пропажи. Оказалось, что все эти годы крест находится в часовне музея Военно-инженерной академии Испании под Мадридом. Также в фильме – о загадке  «Альбомы Милы - уникального документа о зверствах нацистов в годы оккупации, о подвиге реставраторов – восстановлении в кратчайшие сроки  грандиозного памятника «Тысячелетия России», о уникальной реставрации древних храмов и монастырей Новгородской земли.",Софийский крест. Голубь мира
"Война пришла в Псков, когда Вере Цоблиной было 8 лет. Вместо школы, она училась выживать на улицах родного города. Зима 1941-1942 годов выдалась особенно холодной. Дети часто бегали на железную дорогу – искать куски угля, не сгоревшие до конца в паровозных топках. Однажды во время такой «вылазки» дети увидели штабели, сложенные вдоль полотна железной дороги. Им показалось, что это дрова. Но это были замороженные в лед тела советских военнопленных – здесь разгрузили целый эшелон, в котором не выжил никто. Эти страшные «эшелоны смерти» приходили в Псков всю первую военную зиму.",Без срока давности. Эшелоны смерти
"В тридевятом царстве... Так принято начинать сказки? Жил-был король, да на день рождения подарила ему любимая дочка кольцо, не простое, а волшебное. Надел он его на палец и произнес, что хочет быть комариком или жучком, беззаботно жить, да ни в чем особо не нуждаться. И стал он божьей коровкой. Поймал его садовник, что каждый год дарил ему жучков, раскрашенных во все цвета, а тут сама судьба – такой подарок, жук в единственном экземпляре. Смог все-таки король превратиться обратно, а брата, уже успевшего вступить в спор с его дочерью, превратил в таракана. Да снова позабыл он, что кольцо не простое, а волшебное, вот и произнес: «С ума сойти можно…»",Королевский подарок
Мультсериал про куклу Бьянку и ее кукольный домик.,Кукольный домик
"Морского льва, убежавшего из зоопарка и заплывшего в лесную запруду, ранили и преследуют ловцы животных. Несмотря на опасность, Бобр и Белочка придумывают оригинальный способ отправить Котика домой.",Крылатый лев
"Август 1917 года. Первая мировая в разгаре. В Петрограде, в парадном зале офицерского собрания, идет необычный судебный процесс, слушается уникальное дело. Впервые на скамье подсудимых оказался фигурант такого уровня - глава военного ведомства Владимир Сухомлинов. ",Министр на доверии. Дело Сухомлинова
"Каждую неделю, сразу после премьеры новой серии 7 сезона, эксперты, звездные гости и преданные фанаты сериала «Игра Престолов» собираются в студии, чтобы обсудить события и разобраться в хитросплетениях сюжета.",Спойлерная
"Занимательная азбука, с помощью которой можно учить буквы с ребенком. Для лучшего запоминания букв малышу показаны 15 предметов, начинающихся на одну букву в виде картинок на крутящемся барабане. Малыш крутит барабан и нажимает на разные картинки, картинки оживают и предметы начинают двигаться, а малыш читает по слогам каждое слово.",Алфавит
"Послушав сказки от воспитательницы, дети принимаются за свои шумные развлечения и буквально громят садик, пока нянечка на секунду отвлекается. Самого озорного мальчика, Арсюшу Осокина, отправляют в угол и ругают за то, что у него «руки чешутся». Истолковав это буквально, друзья решают раздобыть для мальчика зеленку, чтобы излечить его от чесотки. Почему не надо подслушивать за взрослыми? Что такое «фразеологизмы»? Зачем помогать друзьям?",Детки
"Считается, что на балалайке можно играть только незамысловатые народные мелодии. На самом же деле это настоящий концертный инструмент, возможности которого позволяют исполнять практически любую музыку. Фильм рассказывает о его особенностях, устройстве и людях, его делающих и играющих на нем. ",И всего лишь три струны...
"Псевдодокументальный фильм про боевой отряд бардов, сражавшийся с новыми технологиями.",Давай забудем о ладонях
"Фильм посвящен выдающемуся хоккейному тренеру Аркадию Ивановичу Чернышеву, под руководством которого сборная СССР выиграла 4 Олимпиады и одиннадцать раз становилась чемпионом мира.",Повесть о настоящем тренере
"В январе 1982 года Москву потрясла новость – арестован глава Союзгосцирка и бывший директор нескольких столичных театров Анатолий Колеватов. Человек не просто уважаемый и влиятельный, а, можно сказать, неприкасаемый. Друг самого Щелокова – министра Внутренних дел. А тут, вдруг «расстрельная» статья – получение взятки в особо крупных размерах. До сих пор в артистической среде в его виновность не верят и задаются вопросом: «Кто же стоял за »цирковым делом'?",Колеватов. Куда уехал цирк?
"Мультфильм является превосходным обучающим пособием для самых маленьких малышей. Наряду с различными цветами и оттенками, юные зрители на своем уровне узнают о ракетах, гравитации, космосе, звездах и различных планетах. Также вместе с нашими помощниками Бубликом и Рексом нам предстоит выйти в открытый космос, ведь какие же приключения без опасностей? А в бесконечном космосе может произойти всякое. А от опасностей Белку и Стрелку будут оберегать различные полезные правила о том, как вести себя за бортом корабля. Разве это не удивительное приключение?",Раскраска с Белкой и Стрелкой
"Фильм поведает нам о том, как снималась известная картина «Волкодав из рода Серых Псов». Лента, вышедшая на экраны в 2006 году, не произвела большого впечатления на критиков, но понравилась узкому кругу любителей фэнтези. Экранизация популярного романа Марии Семеновой расскажет нам о приключениях прославленного война, который, волею судеб, оказался заключен в острог и должен был встретить там свою смерть. Из фильма мы узнаем особенности операторской работы, режиссерские задумки и процесс создания фильма, а также познакомимся поближе с главным героем картины.",Волкодав из рода Серых Псов. Фильм о фильме
"Недавно итальянцы поделились уникальной информацией – они обнаружили древнюю тюрьму, где во время Первой мировой войны находились русские военнопленные. 100 лет эта история считалась легендой. Но к столетию окончания Первой мировой войны Триест, как и многие города мира, рассекретил свои архивы, и легенда ожила. Что здесь делали русские? Зачем их пленение тщательно скрывали от всего мира? И зачем тюрьму, где содержали русских, замуровали?",Солдаты-призраки. Русские в Триесте
"Об историях из жизни бегемотиков, которые беззаботно живут на прекрасном острове. Крокодил Крок рассказывает бегемотикам свои сказки о чудесах окружающего мира.",Волшебное зеркало
"О сериалах можно рассказывать тысячами разных способов. Зачем останавливаться на одном? «Клуб А» - это тележурнал, рубрикатор. У каждой рубрики - свой ведущий, он же редактор со своим особенным стилем. Рассказы о самых актуальных премьерах и классике, эксклюзивные интервью со звездами, репортажи со съемочных площадок и самые разные взгляды на сериалы – со спойлерами и без.",Клуб А
"Действие фильма состоит из восьми частей, каждая из которых рассказывает об определенном этапе в развитии кино. Например, в первой части мы видим, как в городе появляется первый кинотеатр. Афиши с фильмами оживленно расклеивает местный художник, молодая энергичная девушка собирает за вход монетки, а суровый техник крутит ручку проектора. На экранах идет «Стенька Разин» – хит советского киноискусства. Люди толпой валят в кинотеатр, и постепенно из диковинного развлечения кино превращается в общедоступное удовольствие…",Наследный принц республики
"Фильм «Оставивший свет…» посвящён памяти театрального режиссёра, актёра театра и кино Владимира Агеева. Его называли «главным алхимиком современной режиссуры». Ученик Анатолия Васильева, Владимир Агеев прокладывал собственный путь в искусстве. Поиски и исследования привели его к созданию своего творческого стиля, к «Театру тайны и радости». В фильме используются архивные записи репетиций режиссёра, фрагменты из спектаклей.",Оставивший свет...
"Съёмки из экспедиций с холодных берегов Охотского моря, где обитает сивуч, или северный морской лев. Фильм расскажет об этом звере и ответит на вопрос «Сколько в море львов?»",Сколько в море львов?
"Фильм рассказывает историю трёх танцевальных пар, объединённых общей целью: сохранить своё культурное наследие, отношения с любимыми и что-то очень важное внутри самих себя. Их человеческие истории о любви и взаимопомощи несмотря ни на что показывают, как ангольский танец «кизомба» помогает преодолевать глубокие внутренние травмы и находить ответы на самые важные вопросы. Фильм предлагает отправиться в путешествие по Испании, Португалии, Анголе и Панаме, и посмотреть поближе на этническое многообразие героев и корни самого танца.",Dance for it
"Фильм посвящён актеру уникального таланта, блистательному мастеру художественного слова  Александру Филиппенко. В театре и кино Филиппенко исполнил множество разнообразных ролей, как положительных, так и отрицательных героев, сыграл более чем в 100 фильмах, десятках спектаклей. Особенно ему удавались роли «ярких представителей темных сил», как всерьез написал кто-то из критиков.",Александр Филиппенко
,Кухня. Война за отель. Фильм о фильме
"Изучение профессий в форме интересного путешествия ведущего, такого же любознательного, молодого и современного, как зрители программы. Он сам попробует себя в каждой из профессий, поделится впечатлениями со зрителями и поможет узнать больше о тонкостях любой специальности.",Есть такая профессия
"Фильм рассказывает об интереснейшей экспедиции на квадроциклах по российской глубинке. Десяток смельчаков отправился из Питера в Рыбинск по нехоженым тропам, лесовозным колеям и дорогам, оставшимся лишь на военных картах прошлого столетия. Особую пикантность приключению добавляло то, что все квадроциклы — российского производства! Отсюда и название экспедиции — российские квадроциклы ищут свою «дорогу домой»: на завод, где они были произведены. В пути участников ждут лесные приключения, внедорожные подвиги, красота русской природы и настоящее осознание того, что такое дружба и взаимопомощь. Ведь только все вместе они смогут преодолеть эту тысячу километров за 10 дней!",Дорога домой
Сериал рассказывает про отношения между людьми и вулканами.,Вулканы
,Английский язык
"Студенты театрального факультета решают позвонить известному режиссеру. На их удивление он отвечает взаимностью и даже назначает встречу. Ребята хотят сниматься в кино, а что хочет известный режиссер?",Известный режиссер
,Макс и друзья игрушки
"Сина, Ло и динозаврик по имени Дин поют, танцуют и путешествуют вместе. Через веселые песни они познают природу, различные природные явления, а также учат детей дружбе и доброте.",Сина и Ло
"Пять коротких историй познакомят юных зрителей со знаменитым русским купцом Афанасием Никитиным, который отправился за три моря и стал первым европейцем в Индии.",Афанасий
"Мы привыкли видеть в рекламе и на обложках журналов девушек с определенными параметрами. Индустрия моды установила свои правила, но кто сказал, что их нельзя нарушать? В шоу девушки с размером одежды ХL и больше примут участие в специальных испытаниях, профессиональных фотосессиях, съемках и мастер-классах. ",Модель XL
,Азбука безопасности со Смешариками
"Фильм о физиотерапевте московского детского хосписа «Дом с маяком» Илоне Абсандзе. Она родилась в городе Поти (Грузия), в 90-х бежала от войны в Россию и вот уже более 20-ти лет живёт на два города: Санкт-Петербург и Москва. Реставратор зданий по первому образованию, Илона однажды приняла решение кардинально поменять свою жизнь – ушла в детскую физиологию. Она стала помогать детям с особенностями развития – она стала реставратором их хрупких тел.",У черты
,«Товарищ» вирус: Изоляция
