body,title
"Дирижер отправляется со своим оркестром в Иерусалим, чтобы исполнить ораторию «Страсти по Матфею». Но гастроли оборачиваются трагедией. Черное солнце Иерусалима срывает с главного героя маску  благополучного художника, заставляет увидеть себя в беспощадной наготе эгоизма и жестокости. Иногда за 3 дня человек может полностью переоценить и переосмыслить свою жизнь. Меняться никогда не поздно.",Дирижёр
,Маша и Медведь. Новогодняя песенка
"Провинциальный бизнесмен Каприщев должен вернуть долг. Пытаясь собрать нужную сумму, он лишается всех денег, ценных бумаг, любовницы, офиса и едва не самой жизни. В это же время маляр Дубровский, ремонтирующий офис Каприщева, неожиданно становится миллионером. Именно к нему непостижимым для самого Дубровского образом перекочевывают все активы бизнесмена...","Здравствуйте, мы ваша крыша!"
"Россия, первая половина 90-х. Крупный металлургический комбинат города Ахтарска возглавляет опытный руководитель Вячеслав Извольский. Нищая область, богатый завод и далекая Москва с ее жадными до денег банками. Завод процветает, и наложить лапу на доходы Комбината не терпится многим.",Охота на изюбря
"Олег — столичный психотерапевт. К нему в очередь выстраиваются клиенты центрального округа Москвы. Только в последнее время Олег их не любит, он их терпит. Кризис среднего возраста, жизнь с мамой в 40 лет, потеря самоуважения, медикаментозная зависимость, раздражительность и нарастающая агрессия — никто из клиентов не подозревает о его проблемах.  Со стороны он кажется успешным, счастливо женатым, состоятельным. Никто не знает правду, да и зачем? ",Псих
"Жизнь подполковника Александры Кушнир постепенно возвращается в привычное русло. Кажется, героиня научилась выпутываться из самых сложных ситуаций, и её уже ничем не удивить. Но внезапно всего лишь один визит к врачу переворачивает всё с ног на голову. Расследования, быт героини, её отношения с близкими - ничто уже не будет прежним...",Ищейка 3
"Яркий познавательный мультфильм, главная героиня которого – машина, а точнее, желтый экскаватор по имени Мася. Он просто обожает проводить время на детской площадке – не только с удовольствием, но и с пользой. Мася еще совсем малыш, и только начинает познавать окружающий мир. Все серии сопровождает закадровый голос, который задает Масе вопросы и помогает найти на них правильные ответы.",Экскаватор Мася
"Классический детектив по бестселлеру Бориса Акунина о приключениях сыщицы-монахини Пелагии, которая наделена необычайной интуицией, позволяющей ей успешно расследовать жуткие преступления. Изобретательность Пелагии сродни талантам знаменитой мисс Марпл, благодаря которым она доказывает профессиональным сыщикам, что безвыходных ситуаций не бывает.",Пелагия и белый бульдог
"Действие фильма разворачивается в послевоенные годы в небольшом городке, который захлестнула серия загадочных убийств. Изуродованные трупы с порванным горлом и кровавые следы волчьих лап ввергли местных жителей в панику. Молодой начальник местного УГРО Высик, пытается разобраться в происходящих событиях и понять, кому выгодна атмосфера страха и суеверий, которая сложилась среди работников трофейного склада и элитного конезавода.",По ту сторону волков
Музыкальный проект и канал на YouTube. Авторы сочиняют песенки для малышей и придумывают к ним мультфильмы.,Коте ТВ
"1837 год: еще один год изнурительной кавказской войны. Молодой офицер Григорий Печорин за участие в дуэли отправлен в ссылку в действующую армию. Здесь, на Кавказе, Печорину предстоит стать невольным участником стремительно разворачивающихся событий - схватки с контрабандистами, похищения молодой черкеской княжны, еще одной дуэли.",Герой нашего времени
"Действие авантюрной мелодрамы происходит в Петербурге в конце 1830-х. В атмосфере романтических белых ночей страшные вещи творятся под сводами роскошных дворцов и в закоулках мрачных, зловонных трущоб: порок, предательство, измены, жестокие убийства.",Петербургские тайны
"По сюжету в 1982 году профессор Матвей Пиотровский создаёт машину времени и проводит научный эксперимент, в результате которого одна половина его квартиры останется в восьмидесятых, а вторая попадёт в эпоху интернета. В наше время жилплощадь делят бизнесмен Сергей, его жена Светлана и дочь Кристина. Новое соседство доставляет героям массу неудобств, ведь наслоение двух времён лишает каждую из семей доступа ко второй половине квартиры. Проблем добавит и внук учёного Паша, прождавший целых 38 лет, чтобы предотвратить одно трагическое событие.",Гости из прошлого
"Главный герой фильма  Константин — успешный молодой архитектор. Он аккуратно выстраивает карьеру и находится в удобных отношениях с девушкой Яной. Но его спокойная и благополучная жизнь резко меняется, когда однажды на пороге своей квартиры он находит трехмесячную девочку — Доминику. Вскоре у девочки обнаруживается феноменальная способность — взрослеть на несколько лет после каждой вспышки гнева героя. Константин понимает, что Доминика послана ему не напрасно.",Доминика
"Трогательно наивная девушка Настя из провинции едет в Москву, чтобы стать композитором, и там впервые сталкивается с реальностью. От навалившихся проблем голова идет кругом, а музыка слышна все реже и реже. Что же выбрать? Призвание или... Обычно жизнь человека определяется обстоятельствами, но для Насти решающим обстоятельством оказывается сама человеческая жизнь.",Слушая тишину
"Жизнь Толика не удалась, спортивная карьера не состоялась, жена ушла к другому. Неуспешный, нелюбимый, безнадежный он потерял веру в себя. Все меняет случайная встреча со странной незнакомкой Анной Ильиничной, которая предлагает ему принять участие в необычном марафоне в далекой Америке...",Марафон
"Стив Николс приезжает в Москву заключить контракт. Стив не подозревает, что должен стать прикрытием для транспортировки наркотиков, поставляемых местным бандитом по прозвищу «Красный змей». И его личное согласие - всего лишь технический вопрос.",Красный змей
"Роман ведет холостяцкий образ жизни и свое шоу на радио. Как заправский психолог он раздает советы слушателям, приправляя их колкими шутками. Пока одна из них не оборачивается против него самого. На вопрос 20-летней Алены, ехать ли ей к отцу, Роман отвечает «Конечно! Я был бы рад». Он не знает, что в эфире – плод его случайной связи, а он сам в одночасье стал не только отцом, но и дедушкой Алениного сына. Новоиспеченные родственники погружают в ад беззаботного Романа и его девушку Сашу, светскую львицу и владелицу радиостанции. Не меньшее разочарование ждет и Алену. Только чудо сможет сделать их четверых одной семьей…",Дабл трабл
"Маргарет Мак-Леод, преследуемая своим бывшим мужем, лишается опеки над дочерью и брошена на произвол судьбы, не имея никаких средств к существованию. Она становится танцовщицей, отчаявшись найти какой-либо другой заработок.",Мата Хари
"Ранняя весна 1942 года. В лесу пережил зиму партизанский отряд Григория. Их осталось очень мало: сам Григорий, Муха, несколько мужиков из деревни, несколько красноармейцев. Мало мужчин, но много женщин, детей и стариков. Они не могут вернуться в деревню. В округе свирепствуют каратели - эсесовцы и латышские полицаи. Поэтому выжить они могут только в лесу. Григорий живет с Дашей, а Алена - в одиночестве. Она замкнулась в себе, ведь в жизни у нее сломано все – муж оказался с другой, а тот, кого полюбила – оказался предателем.",1942
"Москва. Редкий солнечный день. Александр надеется отдохнуть от рабочей суеты и заняться любимым делом. Однако клиенты требуют встреч, а девушка жаждет похода по магазинам. Вдобавок ко всему, на один день из Гомеля приезжает бывший одноклассник, который во что бы то ни стало хочет выпить с Саней пиво. Да к тому же срочно требуется помощь ещё одному другу. А тут, вдруг, к одной из клиенток вспыхивает любовь. А приехавший одноклассник внезапно рушит все планы. И всё это за один день. Оказывается, в бешеном водовороте столичной жизни очень легко потерять себя. Либо, наоборот, найти.","Москва, я терплю тебя"
"Блокадный Ленинград. Зима 1942-го. Советская контрразведка узнает, что немцы готовят диверсию на «Дороге жизни» – единственном пути, по которому в город доставляется продовольствие и другие грузы. Скорее всего, диверсант - один из водителей «полуторок», работающих на замерзшем Ладожском озере. Найти и остановить врага должен капитан НКВД Сергиенко…",Ладога
"В одном мире живут две сестры. Одной из которых крупно не повезло в самом начале жизни: Ульяна – «щипцовый ребенок», к тридцати годам сохранившая миросозерцание, поведение и реакции десятилетней девочки. Второй – Лизе – не повезло еще больше. Она – здоровый человек, жизнь которого полностью зависит от сестры-инвалида, вольно или невольно разрушающей планы своей амбициозной сестры-актрисы.",Дура
"Фильм основан на невероятной, но реальной истории борьбы иранского танцора Афшина Гаффариана за свободу самовыражения через танец в стране, где этот вид искусства находится вне закона. Используя YouTube в качестве учебника, главный герой вместе с друзьями создает подпольную танцевальную группу. В пустыне, вдали от глаз полиции, они устраивают секретное танцевальное шоу. Несмотря на все меры предосторожности, этот акт творчества, мужества и неповиновения влечет за собой события, из-за которых жизнь Афшина оказывается в опасности. «Танцующий в пустыне» – это правдивая история о молодежи, которая подвергает риску свою жизнь в борьбе за права человека и исполнение своей мечты.",Танцующий в пустыне
"Действие фильма происходит в 1920-е годы. В нём рассказывается о первых заданиях Исаева. Сначала он едет в Ревель, чтобы пресечь контрабанду ценностей, похищенных из Гохрана. По возвращении его отправляют во Владивосток для сбора информации о действиях белых. Затем ему приходится уехать за границу для наблюдения за контрреволюционной эмиграцией.",Исаев
"Фильм рассказывает о последнем годе жизни Генерального секретаря ЦК КПСС Леонида Ильича Брежнева - человека, взошедшего на вершину партийной номенклатуры благодаря интригам и сумевшего удержаться у власти на протяжении 18-ти лет.",Брежнев
"Конец XIII-го века.  В столицу Руси прибывает посланник Золотой Орды – Менгу-Темир, красавец и ценитель женской красоты.  Он приехал, чтобы угнать в Орду тысячи русских воинов, но готов довольствоваться лишь частью, если Великий князь Ярослав отдаст княгиню Устинью, жену его брата Бориса.  Ярослав не готов нарушить законы Веры и Чести, но Борис сам идет на этот шаг, надеясь, что эта жертва обеспечит ему княжеский престол. Устинья с караваном отправляется на чужбину.",Золотая орда
"В жизни Миры всё замечательно: она - владелица модной галереи, дома ждёт любящий муж. Но однажды на берегу моря находят мужчину с амнезией, который помнит её имя. Никто не знает, кто он. Его нет ни в одной базе данных. Но он знает о ней то, что может знать только очень близкий человек, хотя Мира ни разу в жизни его не видела. Благополучный мир Миры начинает разрушаться, когда выясняется, что неизвестный провёл несколько лет на Ближнем Востоке и за ним идёт настоящая охота.",Пилигрим
"Южный город, ночной клуб, в котором зажигает молодой талантливый диджей Денис Орлов. У него есть все: девушка, друзья, признание и мечта - стать профессиональным музыкантом. Но когда возникла необходимость в стартовом капитале, который должен быть положен в основу новой жизни, Денис ступил на кривую дорожку. Этот шаг стал для него фатальным, затянув в такую жизнь, которой герой вовсе не желал.",Тиски
"Сюжет фильма основан на реальных фактах, связанных с обнаружением в 1993 году в небольшом украинском городе Кировограде огромной коллекции древностей стоимостью около миллиарда долларов, принадлежавшей обычному электрику Александру Ильину, а также на материалах расследований, гипотезах и домыслах, появившихся по этому поводу за пятнадцать лет.",Синдром дракона
"Сентябрь 1939 года. Начало Второй Мировой войны. В Крым приезжает майор советской разведки Соколов. Его главная цель – выявить агентурную сеть террористической антисоветской организации РОВС. Руководит контрразведкой Русского общевоинского  союза - штабс-капитан Семенов, псевдоним Крест. ",Гетеры майора Соколова
"Трагический рассказ о любви и одиночестве... о неизвестной частной жизни великого русского писателя Ивана Бунина. Запутанная любовная история, участниками которой являются сам Бунин, его жена Вера, молодая поэтесса Галина Плотникова, оперная певица Марга Ковтун и литератор Леонид Гуров.",Дневник его жены
"Действие охватывает период времени с 1913 до 1921 года, отражая драматические события российской истории, ураганом пронёсшиеся через судьбы людей и страны, оставив после себя для одних руины прошлого, для других – фундамент для новой жизни.",Крылья Империи
"В браке Андрея и Нади что-то сломалось. Он отправляется жить в Москву, она с детьми остается в Иркутске. В канун Нового Года семья снова собирается вместе, но, похоже, в последний раз. Слово «развод» звучит вполне определенно. 1-го января, казалось бы, всё уже решено, но целая цепочка событий, - смешных, грустных, иногда даже странных и необъяснимых - будто удерживает семью от неправильного шага. Все они потеряются и найдут друг друга в эту волшебную ночь на острове Ольхон и поймут, что прошлые обиды легко забыть, а в жизни есть нечто куда более важное.",Млечный путь
"Сиреневые Холмы, Владение 18 - адрес обычной многоэтажки на окраине города. Скоро здесь будет новый цветущий микрорайон, но пока вокруг царит девственное запустение. Сейчас цены на квартиры в этом доме так заманчиво низки... И продают их, оказывается, только по специальной благотворительной программе инвесторов! Когда ещё небогатым молодожёнам Свете и Максиму представится такой удивительный шанс переехать из крохотной коммуналки в собственную просторную квартиру?..",Владение 18
Личная драма молодого врача-интеллигента разворачивается на фоне социальных и исторических потрясений начала прошлого века. Рассказ о пронзительной любви и духовных исканиях.,Доктор Живаго
"В поезде, идущем в Москву, волею судьбы оказываются три очень разных человека, которым предстоит стать главными героями этой 200 серийной истории.",Обручальное кольцо
